{
  "$schema": "https://tommymoonn.github.io/archeion/schemas/archeion-theme-v1.schema.json",
  "schemaVersion": 1,
  "id": "paper-light",
  "name": "Paper Light",
  "author": "Khoa Luong",
  "description": "A warm paper-inspired light theme for Archeion.",
  "base": "light",
  "app": {
    "canvas": "#F6F3ED",
    "canvasDeep": "#EEE8DE",
    "surface": "#FFFFFF",
    "surfaceRaised": "#FBF8F2",
    "surfaceHover": "#F2ECE2",
    "frame": "#EEE8DE",
    "sidebar": "#EEE8DE",
    "main": "#F8F5EF",
    "mainRaised": "#FFFFFF",
    "line": "#DDD4C8",
    "lineStrong": "#CABEAE",
    "text": "#403B34",
    "textStrong": "#1E1A17",
    "muted": "#746B5F",
    "mutedSoft": "#91887D",
    "accent": "#386F99",
    "accentStrong": "#22577C",
    "focus": "#386F99",
    "success": "#467A55",
    "warning": "#8A641F",
    "error": "#AA4350",
    "info": "#386F99"
  },
  "reader": {
    "base": "light",
    "background": "#F5F4F1",
    "surface": "#EBE9E4",
    "line": "#D8D5CE",
    "text": "#353331",
    "strong": "#171615",
    "muted": "#77736E",
    "focus": "#386F99",
    "danger": "#8E3440",
    "link": "#356F96",
    "codeBackground": "#EBE9E4",
    "selection": "#BFD7E8"
  }
}
