{
  "$schema": "https://tommymoonn.github.io/archeion/schemas/archeion-theme-v1.schema.json",
  "schemaVersion": 1,
  "id": "moon-ink",
  "name": "Moon Ink",
  "author": "Khoa Luong",
  "description": "A quiet blue-black Archeion theme.",
  "base": "dark",
  "app": {
    "canvas": "#171717",
    "canvasDeep": "#121213",
    "surface": "#1D1D1F",
    "surfaceRaised": "#242427",
    "surfaceHover": "#29292D",
    "frame": "#202023",
    "sidebar": "#202023",
    "main": "#151516",
    "mainRaised": "#1D1D20",
    "line": "#303034",
    "lineStrong": "#414147",
    "text": "#D6D3D9",
    "textStrong": "#EBE8EF",
    "muted": "#929096",
    "mutedSoft": "#6F6D73",
    "accent": "#8FC1E3",
    "accentStrong": "#B8D9EF",
    "focus": "#C9C4EF",
    "success": "#A0CDB0",
    "warning": "#D1AD68",
    "error": "#D9707E",
    "info": "#8FC1E3"
  },
  "reader": {
    "base": "dark",
    "background": "#151516",
    "surface": "#1D1D20",
    "line": "#303034",
    "text": "#D6D3D9",
    "strong": "#EBE8EF",
    "muted": "#929096",
    "focus": "#C9C4EF",
    "danger": "#E58A96",
    "link": "#8FC1E3",
    "codeBackground": "#1D1D20",
    "selection": "#435A70"
  }
}
